{
 "schema_version": "1.0",
 "rfam_acc": "RF00162",
 "visualisation": {
  "detail_max": 50,
  "small_group": 5
 },
 "dataset": {
  "n_mapped_instances": 29,
  "n_mapped_entries": 28,
  "n_clustered_instances": 29,
  "n_clustered_entries": 28,
  "n_excluded_instances": 0,
  "inclusion_rule": "observed (complete base, C4', C3') at >= 91 consensus positions of the aptamer core; comparisons use the 86 positions observed in every included instance",
  "coverage_threshold": 91,
  "fixed_correspondence": "Rfam consensus match states observed with complete base atoms in every eligible instance",
  "shared_positions": [
   1,
   2,
   3,
   4,
   5,
   6,
   7,
   8,
   10,
   11,
   12,
   13,
   15,
   16,
   17,
   18,
   19,
   20,
   21,
   22,
   23,
   24,
   25,
   26,
   27,
   28,
   29,
   30,
   31,
   32,
   33,
   34,
   35,
   36,
   37,
   38,
   39,
   40,
   42,
   43,
   44,
   45,
   46,
   47,
   48,
   49,
   50,
   67,
   68,
   69,
   70,
   71,
   72,
   73,
   74,
   75,
   76,
   77,
   78,
   79,
   80,
   81,
   82,
   83,
   84,
   85,
   89,
   90,
   91,
   92,
   93,
   94,
   95,
   96,
   97,
   98,
   99,
   100,
   101,
   102,
   103,
   104,
   105,
   106,
   107,
   108
  ],
  "n_shared_positions": 86,
  "instances": [
   "2gis_1_A_A",
   "2ydh_1_A_A",
   "2ygh_1_A_A",
   "3gx2_1_A_A",
   "3gx3_1_A_A",
   "3gx5_1_A_A",
   "3gx6_1_A_A",
   "3gx7_1_A_A",
   "3iqn_1_A_A",
   "3iqp_1_A_A",
   "3iqr_1_A_A",
   "3v7e_2_C_C",
   "3v7e_2_D_D",
   "4aob_1_A_A",
   "4b5r_1_A_A",
   "4kqy_1_A_A",
   "5fjc_1_A_A",
   "5fk1_1_A_A",
   "5fk2_1_A_A",
   "5fk3_1_A_A",
   "5fk4_1_A_A",
   "5fk5_1_A_A",
   "5fk6_1_A_A",
   "5fkd_1_A_A",
   "5fke_1_A_A",
   "5fkf_1_A_A",
   "5fkg_1_A_A",
   "5fkh_1_A_A",
   "7eaf_1_A_A"
  ],
  "excluded": [],
  "mapping_check": {
   "n_instances_checked": 29,
   "n_positions_checked": 86,
   "result": "every clustered instance has a match-state residue with coordinates at every shared position"
  }
 },
 "default_metric": "discrepancy",
 "metrics": {
  "discrepancy": {
   "label": "Geometric discrepancy",
   "short": "D",
   "kind": "dissimilarity",
   "stored_quantity": "D",
   "distance": "D",
   "higher_is_more_similar": false,
   "unit": "dimensionless (base-centre deviation in A and base rotation in rad, weight 1, divided by n)",
   "definition": "D = sqrt(L + O) / n after Kabsch superposition of the n base centres: L = sum of squared base-centre deviations, O = sum of squared base-rotation angles (FR3D standard base frames); fixed correspondence on the n shared Rfam consensus positions",
   "values_upper": [
    0.065019,
    0.113917,
    0.052458,
    0.049645,
    0.045605,
    0.066734,
    0.065602,
    0.061942,
    0.111356,
    0.060857,
    0.242595,
    0.229286,
    0.092884,
    0.128462,
    0.237432,
    0.149442,
    0.137284,
    0.116131,
    0.128718,
    0.125967,
    0.087128,
    0.113473,
    0.118959,
    0.10693,
    0.140278,
    0.085384,
    0.116459,
    0.077677,
    0.11029,
    0.062147,
    0.059201,
    0.06038,
    0.072698,
    0.074767,
    0.076269,
    0.118162,
    0.074172,
    0.254456,
    0.240189,
    0.08344,
    0.125768,
    0.241633,
    0.150339,
    0.13848,
    0.123436,
    0.132547,
    0.110782,
    0.089353,
    0.109639,
    0.117101,
    0.10895,
    0.144591,
    0.087069,
    0.122801,
    0.072731,
    0.119493,
    0.112709,
    0.110818,
    0.123564,
    0.129444,
    0.124285,
    0.149871,
    0.118415,
    0.29924,
    0.289403,
    0.129386,
    0.052271,
    0.266133,
    0.076439,
    0.163847,
    0.139351,
    0.149854,
    0.089085,
    0.105544,
    0.129983,
    0.134243,
    0.128683,
    0.166844,
    0.11279,
    0.147689,
    0.122891,
    0.038069,
    0.038158,
    0.053389,
    0.064609,
    0.065423,
    0.115275,
    0.068048,
    0.237174,
    0.224038,
    0.092926,
    0.134187,
    0.235238,
    0.156666,
    0.126115,
    0.109649,
    0.119174,
    0.127027,
    0.086657,
    0.107543,
    0.112826,
    0.10291,
    0.128492,
    0.084587,
    0.111205,
    0.083279,
    0.033935,
    0.054091,
    0.062082,
    0.067706,
    0.111916,
    0.064547,
    0.240207,
    0.226794,
    0.093925,
    0.128178,
    0.235081,
    0.14876,
    0.12552,
    0.107971,
    0.120213,
    0.122557,
    0.081368,
    0.104361,
    0.110101,
    0.100094,
    0.131285,
    0.079035,
    0.110898,
    0.08388,
    0.054554,
    0.068568,
    0.064354,
    0.11163,
    0.067475,
    0.239,
    0.225941,
    0.092628,
    0.12726,
    0.237245,
    0.150115,
    0.12598,
    0.107909,
    0.118246,
    0.123327,
    0.085991,
    0.106099,
    0.112587,
    0.100221,
    0.130243,
    0.080604,
    0.111238,
    0.083861,
    0.071213,
    0.071539,
    0.109676,
    0.068307,
    0.242028,
    0.227922,
    0.102286,
    0.13864,
    0.235304,
    0.157069,
    0.130389,
    0.111919,
    0.12512,
    0.134548,
    0.08896,
    0.112886,
    0.117137,
    0.107039,
    0.13199,
    0.086817,
    0.116042,
    0.091347,
    0.07028,
    0.114085,
    0.065535,
    0.244907,
    0.231832,
    0.096575,
    0.145757,
    0.235954,
    0.164994,
    0.132094,
    0.114639,
    0.128138,
    0.138593,
    0.090703,
    0.113418,
    0.115499,
    0.111509,
    0.134893,
    0.092639,
    0.113033,
    0.085708,
    0.102716,
    0.048805,
    0.246619,
    0.232062,
    0.089652,
    0.13812,
    0.232559,
    0.162774,
    0.140811,
    0.116601,
    0.131032,
    0.134109,
    0.086144,
    0.118661,
    0.118783,
    0.114354,
    0.138162,
    0.086109,
    0.114425,
    0.077245,
    0.101714,
    0.271458,
    0.255028,
    0.130376,
    0.161146,
    0.242182,
    0.181519,
    0.162789,
    0.14281,
    0.156213,
    0.162095,
    0.125196,
    0.142771,
    0.142356,
    0.140237,
    0.159054,
    0.119544,
    0.14606,
    0.121408,
    0.245544,
    0.231251,
    0.093926,
    0.132377,
    0.231023,
    0.149735,
    0.134258,
    0.109108,
    0.12447,
    0.129579,
    0.080166,
    0.110326,
    0.114044,
    0.108471,
    0.133779,
    0.0782,
    0.111984,
    0.081008,
    0.047808,
    0.256894,
    0.309135,
    0.293893,
    0.319125,
    0.265074,
    0.261313,
    0.265051,
    0.293955,
    0.255402,
    0.266763,
    0.269488,
    0.27034,
    0.268688,
    0.248895,
    0.266093,
    0.256167,
    0.241833,
    0.298461,
    0.282545,
    0.310196,
    0.254787,
    0.250651,
    0.254282,
    0.282365,
    0.242334,
    0.255008,
    0.258816,
    0.257641,
    0.257836,
    0.236959,
    0.253749,
    0.240724,
    0.136089,
    0.240517,
    0.164613,
    0.116296,
    0.100718,
    0.106882,
    0.122302,
    0.085812,
    0.093374,
    0.093221,
    0.093318,
    0.116666,
    0.096936,
    0.09593,
    0.062463,
    0.27388,
    0.067875,
    0.167209,
    0.141757,
    0.152265,
    0.079207,
    0.107262,
    0.131239,
    0.134455,
    0.130367,
    0.171306,
    0.118153,
    0.149187,
    0.131955,
    0.286006,
    0.25793,
    0.246962,
    0.251966,
    0.263308,
    0.24268,
    0.243112,
    0.246344,
    0.251821,
    0.259487,
    0.242718,
    0.246659,
    0.243208,
    0.177504,
    0.155201,
    0.164114,
    0.114966,
    0.127226,
    0.146985,
    0.153458,
    0.148499,
    0.183256,
    0.136333,
    0.166804,
    0.157005,
    0.05503,
    0.047564,
    0.166564,
    0.113935,
    0.064126,
    0.072673,
    0.084706,
    0.068215,
    0.106912,
    0.073034,
    0.132142,
    0.044448,
    0.142804,
    0.085291,
    0.056693,
    0.058569,
    0.073161,
    0.064017,
    0.086792,
    0.061784,
    0.111583,
    0.152313,
    0.102258,
    0.05551,
    0.067746,
    0.073521,
    0.058083,
    0.104515,
    0.064157,
    0.120355,
    0.106178,
    0.124084,
    0.129515,
    0.121086,
    0.168882,
    0.114358,
    0.14538,
    0.118556,
    0.08671,
    0.082634,
    0.083191,
    0.116844,
    0.063677,
    0.087484,
    0.086404,
    0.046332,
    0.057985,
    0.08437,
    0.085015,
    0.062271,
    0.104772,
    0.063682,
    0.089421,
    0.087258,
    0.061067,
    0.104908,
    0.095865,
    0.08612,
    0.073706,
    0.101507,
    0.1105,
    0.080551,
    0.131284,
    0.09193,
    0.088998,
    0.108174
   ],
   "values_layout": "row-major upper triangle (i < j) in dataset.instances order; diagonal 0",
   "value_range": {
    "min": 0.033935,
    "max": 0.319125
   },
   "distance_range": {
    "min": 0.033935,
    "max": 0.319125
   },
   "clustering": {
    "method": "agglomerative hierarchical clustering",
    "linkage_method": "average (UPGMA)",
    "distance": "D",
    "linkage": [
     [
      4,
      5,
      0.033935,
      2
     ],
     [
      29,
      3,
      0.038113,
      3
     ],
     [
      18,
      19,
      0.044448,
      2
     ],
     [
      22,
      23,
      0.046332,
      2
     ],
     [
      11,
      12,
      0.047808,
      2
     ],
     [
      8,
      10,
      0.048805,
      2
     ],
     [
      30,
      0,
      0.049236,
      4
     ],
     [
      31,
      17,
      0.051297,
      3
     ],
     [
      2,
      14,
      0.052271,
      2
     ],
     [
      35,
      6,
      0.057192,
      5
     ],
     [
      32,
      24,
      0.060833,
      3
     ],
     [
      13,
      28,
      0.062463,
      2
     ],
     [
      36,
      25,
      0.063438,
      4
     ],
     [
      21,
      26,
      0.063677,
      2
     ],
     [
      38,
      1,
      0.063889,
      6
     ],
     [
      39,
      27,
      0.065681,
      4
     ],
     [
      43,
      34,
      0.067553,
      8
     ],
     [
      45,
      7,
      0.067832,
      9
     ],
     [
      37,
      16,
      0.072157,
      3
     ],
     [
      41,
      44,
      0.072243,
      8
     ],
     [
      46,
      42,
      0.085384,
      11
     ],
     [
      49,
      40,
      0.087869,
      13
     ],
     [
      47,
      20,
      0.094419,
      4
     ],
     [